{
  "backup_location": null,
  "next_steps": {
    "delta_summary_command": null,
    "publish_reference_artifacts_command": "py -3.11 scripts/generate/publish_reference_artifacts.py",
    "run_all_command": "py -3.11 scripts/verify/run_all.py",
    "verify_artifact_integrity_command": "py -3.11 scripts/verify/verify_artifact_integrity.py"
  },
  "published": {
    "canonical_artifacts_updated_by_refresh": false,
    "delta_summary_updated_by_refresh": false,
    "manifest_included": false,
    "provenance_path": "public/artifacts/refresh-provenance.json"
  },
  "refresh_date": "2026-04-30",
  "requested_versions": {
    "core": "v0.20.1",
    "frontend": "v1.44.13"
  },
  "resolved_commits": {
    "core": "64b8457f55cd7fb54ca7a956d9c73b505e903e0c",
    "frontend": "389ff8ba49468cc3afa11aec5778224689a8f9b9"
  },
  "runtime_object_info": {
    "merged_into_node_api_schema": false,
    "requested": false
  }
}
